{
  "schema_version": "symmetry.decision.v1",
  "decision_id": "88888888-8888-4888-8888-888888888888",
  "goal_id": "11111111-1111-4111-8111-111111111111",
  "goal_revision": 1,
  "work_item_id": null,
  "kind": "plan",
  "action_hash": "sha256:7777777777777777777777777777777777777777777777777777777777777777",
  "subject_hash": null,
  "state": "open",
  "question": "Should the operator admit this plan?",
  "options": [
    {"id": "accept", "label": "Accept", "consequence": "The work item may be settled."},
    {"id": "reject", "label": "Reject", "consequence": "A repair task is required."}
  ],
  "resolution": null,
  "actor_ref": null,
  "expires_at": null,
  "lock_version": 1,
  "created_at": "2026-09-08T00:03:00Z",
  "updated_at": "2026-09-08T00:03:00Z"
}
