{
  "schema_version": "symmetry.decision.v1",
  "decision_id": "88888888-8888-4888-8888-888888888888",
  "goal_id": "11111111-1111-4111-8111-111111111111",
  "goal_revision": 1,
  "work_item_id": "33333333-3333-4333-8333-333333333333",
  "kind": "review",
  "action_hash": "sha256:7777777777777777777777777777777777777777777777777777777777777777",
  "subject_hash": "sha256:1111111111111111111111111111111111111111111111111111111111111111",
  "state": "superseded",
  "question": "Accept the review result?",
  "options": [{"id": "accept", "label": "Accept", "consequence": "Settle the work item."}],
  "resolution": null,
  "actor_ref": null,
  "expires_at": null,
  "lock_version": 2,
  "created_at": "2026-09-08T00:03:00Z",
  "updated_at": "2026-09-08T00:04:00Z"
}
