{
  "schema_version": "symmetry.decision.v1",
  "decision_id": "88888888-8888-4888-8888-888888888888",
  "goal_id": "11111111-1111-4111-8111-111111111111",
  "goal_revision": 1,
  "work_item_id": null,
  "kind": "completion",
  "action_hash": "sha256:7777777777777777777777777777777777777777777777777777777777777777",
  "subject_hash": null,
  "state": "resolved",
  "question": "Accept the verified candidate?",
  "options": [{"id": "accept", "label": "Accept", "consequence": "Settle the work item."}],
  "resolution": {"option_id": "accept", "comment": null, "actor_ref": "operator:test", "resolved_at": "2026-09-08T00:04:00Z"},
  "actor_ref": "operator:test",
  "expires_at": null,
  "lock_version": 2,
  "created_at": "2026-09-08T00:03:00Z",
  "updated_at": "2026-09-08T00:04:00Z"
}
